{
  "$schema": "https://human-writing-rules.example/schemas/visual-acceptance-record.schema.json",
  "fixture_id": "visual.auto-none.repository-announcement.001",
  "fixture_revision": "1.0.0",
  "acceptance_revision": "1.0.0",
  "evaluator": {
    "id": "fixture-review.visual-auto-none.v1",
    "type": "fixture",
    "independence": "not-independent",
    "notes": "Contract fixture review. It verifies applicability and evidence recording, not inter-rater agreement."
  },
  "artifact_sha256": "c3040ae2804d01599635e47dba29bfa106c4cfd735663367f6ba33f20c137d8e",
  "asset_sha256": null,
  "asset_evaluated": false,
  "dimensions": [
    {
      "id": "media_decision",
      "applies": true,
      "verdict": "pass",
      "evidence": "The publication is a short operational announcement. Its final paragraph records that an illustration would not explain the mechanism or add orientation.",
      "findings": []
    },
    {
      "id": "factual_consistency",
      "applies": false,
      "verdict": "not-applicable",
      "evidence": "No asset was selected or produced.",
      "findings": []
    },
    {
      "id": "text_image_alignment",
      "applies": false,
      "verdict": "not-applicable",
      "evidence": "No asset was selected or produced.",
      "findings": []
    },
    {
      "id": "documentary_integrity",
      "applies": false,
      "verdict": "not-applicable",
      "evidence": "No asset was selected or produced.",
      "findings": []
    },
    {
      "id": "platform_handoff",
      "applies": false,
      "verdict": "not-applicable",
      "evidence": "No asset was selected or produced.",
      "findings": []
    },
    {
      "id": "accessibility",
      "applies": false,
      "verdict": "not-applicable",
      "evidence": "No asset was selected or produced.",
      "findings": []
    },
    {
      "id": "rights_provenance",
      "applies": false,
      "verdict": "not-applicable",
      "evidence": "No asset was selected or produced.",
      "findings": []
    }
  ],
  "hard_failures": [
    {
      "id": "false-documentary-visual",
      "status": "not-triggered",
      "evidence": "No visual exists to be presented as documentary evidence."
    },
    {
      "id": "required-disclosure-missing",
      "status": "not-triggered",
      "evidence": "No generated visual or required visual disclosure exists."
    }
  ],
  "overall": "pass",
  "limitations": [
    "The pass applies to the media decision only; asset dimensions remain explicitly not applicable."
  ]
}
